{"artifact_id":"ART_VALIDATION_DOC_ARCH_PHILIP_K_DICK_LETTERS_RAY","artifact_type":"validation","schema_version":"1.0","generated_at":"2026-06-11T00:00:00Z","source_id":"DOC_ARCH_PHILIP_K_DICK_THE_SELECTED_LETTERS_OF_PH","generated_by":{"agent_role":"validation_agent","name":"Claude (Haiku 4.5)","model":"claude-haiku-4-5-20251001","prompt_version":"validation.v1"},"target_artifact_id":"ART_RAW_EXTRACTION_DOC_ARCH_PHILIP_K_DICK_LETTERS_PEOPLE_RAY","validation_status":"pass","schema_errors":[],"missing_required_fields":[],"grounding_issues":[],"suspected_hallucinations":[],"duplicate_or_conflicting_claims":[],"recommended_fixes":[],"validator_notes":"Extraction grounded in bibliography and correspondence. Ray Faraday Nelson's collaboration on The Ganymede Takeover verified."}
